{
  "version": 1,
  "source": "demo://composite-firmware",
  "output": "output/video/trigram-turntable.mp4",
  "width": 1280,
  "height": 720,
  "fps": 30,
  "duration_seconds": 4.0,
  "stride": 1,
  "point_budget": 12000,
  "point_size": 1.8,
  "brightness": 1.25,
  "perspective": 0.72,
  "background": [0, 0, 0],
  "show_guides": true,
  "easing": "smooth_step",
  "overwrite": false,
  "keyframes": [
    { "at": 0.0, "morph": 0.0, "yaw": -0.72, "pitch": 0.38, "zoom": 0.92 },
    { "at": 0.5, "morph": 0.0, "yaw": 2.4215927, "pitch": -0.12, "zoom": 1.08 },
    { "at": 1.0, "morph": 0.0, "yaw": 5.5631853, "pitch": 0.38, "zoom": 0.92 }
  ]
}
