{
  "version": 1,
  "source": "demo://composite-firmware",
  "output": "output/video/sequence-helix-dolly.mp4",
  "width": 1080,
  "height": 1080,
  "fps": 30,
  "duration_seconds": 5.0,
  "stride": 1,
  "point_budget": 18000,
  "point_size": 2.0,
  "brightness": 1.35,
  "perspective": 0.82,
  "background": [0, 0, 0],
  "show_guides": false,
  "easing": "smooth_step",
  "overwrite": false,
  "keyframes": [
    { "at": 0.0, "morph": 2.0, "yaw": -0.72, "pitch": 0.62, "zoom": 0.68 },
    { "at": 0.35, "morph": 2.0, "yaw": 1.15, "pitch": 0.05, "zoom": 1.24 },
    { "at": 0.7, "morph": 2.0, "yaw": 3.35, "pitch": -0.55, "zoom": 0.88 },
    { "at": 1.0, "morph": 2.0, "yaw": 5.5631853, "pitch": 0.62, "zoom": 0.68 }
  ]
}
