{
  "version": 1,
  "source": "target/debug/strata-poc",
  "output": "output/video/macho-self-morph-turntable.mp4",
  "width": 960,
  "height": 540,
  "fps": 24,
  "duration_seconds": 5.0,
  "stride": 1,
  "point_budget": 16000,
  "point_size": 1.65,
  "brightness": 1.35,
  "perspective": 0.78,
  "background": [1, 3, 8],
  "show_guides": true,
  "easing": "smooth_step",
  "overwrite": true,
  "keyframes": [
    { "at": 0.0, "morph": 0.0, "yaw": -0.8, "pitch": 0.42, "zoom": 0.72 },
    { "at": 0.22, "morph": 0.65, "yaw": 0.75, "pitch": 0.12, "zoom": 0.98 },
    { "at": 0.48, "morph": 1.0, "yaw": 2.2, "pitch": -0.28, "zoom": 1.25 },
    { "at": 0.74, "morph": 2.0, "yaw": 4.0, "pitch": 0.48, "zoom": 0.95 },
    { "at": 1.0, "morph": 0.0, "yaw": 5.4831853, "pitch": 0.42, "zoom": 0.72 }
  ]
}
