{
  "version": 1,
  "source": "fixtures/video/interleaved-sensor-v1.bin",
  "output": "output/video/interleave-lattice.mp4",
  "width": 1280,
  "height": 720,
  "fps": 30,
  "duration_seconds": 5.0,
  "composition": {
    "domain": "byte",
    "projection_a": "address_raster",
    "projection_b": "alignment_lattice",
    "geometry": "voxels",
    "compare_mode": "morph",
    "mix": 0.0,
    "parameters": {
      "dimensions": "three",
      "row_width": 144,
      "curve_order": 5,
      "aggregation_bytes": 6,
      "lag": 1,
      "ngram_order": 3,
      "window_bytes": 24,
      "hop_bytes": 2,
      "bit_plane": 0,
      "word_bits": 16,
      "little_endian": true,
      "alignment_stride": 6,
      "alignment_max_stride": 48,
      "recurrence_window": 16,
      "recurrence_search_bytes": 4096,
      "recurrence_candidate_budget": 64,
      "recurrence_threshold_percent": 75,
      "spectrum_window": 64,
      "spectrum_bins": 32,
      "hierarchy_max_depth": 6,
      "hierarchy_min_block": 64,
      "hierarchy_threshold_percent": 18
    },
    "channels": {
      "color": "value",
      "height": "none",
      "size": "uniform",
      "opacity": "uniform"
    },
    "overlays": {
      "selection": true,
      "regions": false
    }
  },
  "stride": 1,
  "point_budget": 20000,
  "point_size": 2.2,
  "brightness": 1.3,
  "perspective": 0.55,
  "background": [
    3,
    7,
    12
  ],
  "show_guides": false,
  "look": {
    "palette": "cividis",
    "primitive": "voxel",
    "contrast": 0.88,
    "saturation": 0.95,
    "vignette": 0.1,
    "guide_opacity": 0.0
  },
  "easing": "smooth_step",
  "overwrite": true,
  "keyframes": [
    {
      "at": 0.0,
      "morph": 0.0,
      "yaw": 0.0,
      "pitch": 0.0,
      "zoom": 0.86
    },
    {
      "at": 0.28,
      "morph": 0.45,
      "yaw": 0.72,
      "pitch": 0.18,
      "zoom": 1.02
    },
    {
      "at": 0.55,
      "morph": 1.8,
      "yaw": 1.58,
      "pitch": -0.14,
      "zoom": 1.1
    },
    {
      "at": 0.8,
      "morph": 3.0,
      "yaw": 2.42,
      "pitch": 0.22,
      "zoom": 1.02
    },
    {
      "at": 1.0,
      "morph": 3.0,
      "yaw": 3.18,
      "pitch": 0.08,
      "zoom": 0.88
    }
  ]
}